{"run":17,"commit":"41fb69a","metric":934,"metrics":{"first_playable_audio_ms":593,"overlap_ms":0,"max_chunk_deficit_ms":341,"max_binary_gap_ms":501,"total_turn_ms":12815,"chunk_count":44,"server_first_frame_ms":455,"server_first_decode_ms":135,"server_first_queue_wait_ms":1,"holdout_realtime_penalty_ms":964,"holdout_first_playable_audio_ms":607,"holdout_overlap_ms":0,"holdout_max_chunk_deficit_ms":357},"status":"discard","description":"Coalesce websocket text deltas to reduce text chatter during streaming, but discard because audio smoothness still regresses versus the current best.","timestamp":1774499836823,"segment":0,"confidence":49.214165261382796,"asi":{"hypothesis":"Reducing per-token text websocket traffic might free enough scheduling headroom to improve audio chunk delivery without changing final text semantics.","rollback_reason":"Primary metric regressed from 784ms to 934ms. First playable audio and chunk deficit both got worse despite lower chatter.","next_action_hint":"Treat text-delta coalescing as a UX cleanup idea, not a realtime optimization. Remaining wins are unlikely to come from websocket text traffic.","learned_tradeoff":"Audio starvation appears dominated by generation/decode cadence, not by the cost of sending every text update over the websocket."}}
{"run":18,"commit":"41fb69a","metric":835,"metrics":{"first_playable_audio_ms":547,"overlap_ms":0,"max_chunk_deficit_ms":288,"max_binary_gap_ms":448,"total_turn_ms":24019,"chunk_count":87,"server_first_frame_ms":415,"server_first_decode_ms":128,"server_first_queue_wait_ms":1,"holdout_realtime_penalty_ms":877,"holdout_first_playable_audio_ms":572,"holdout_overlap_ms":0,"holdout_max_chunk_deficit_ms":305},"status":"discard","description":"Increase the stream-event channel capacity from 64 to 256 to reduce producer backpressure, but discard because it does not beat the current best websocket result.","timestamp":1774500150476,"segment":0,"confidence":68.18691588785046,"asi":{"hypothesis":"If the model worker is occasionally blocked by the bounded stream-event channel, a larger buffer could reduce backpressure and improve audio chunk timing.","rollback_reason":"Primary metric regressed from 784ms to 835ms, with slightly worse first_playable_audio_ms and holdout penalty. Queue wait was already ~1ms, so channel capacity was not the main bottleneck.","next_action_hint":"Stop probing stream-channel capacity. Remaining work should assume chunk production cadence, not channel backpressure, is the limiting factor.","learned_tradeoff":"A much larger producer buffer does not materially change max_chunk_deficit_ms on this workload, which strongly suggests websocket send backpressure is not dominating."}}
{"run":19,"commit":"41fb69a","metric":855,"metrics":{"first_playable_audio_ms":537,"overlap_ms":0,"max_chunk_deficit_ms":324,"max_binary_gap_ms":484,"total_turn_ms":9585,"chunk_count":36,"server_first_frame_ms":407,"server_first_decode_ms":127,"server_first_queue_wait_ms":1,"holdout_realtime_penalty_ms":878,"holdout_first_playable_audio_ms":592,"holdout_overlap_ms":0,"holdout_max_chunk_deficit_ms":286},"status":"discard","description":"Disable server-side startup pacing entirely and let playback start on the first available chunk, but discard because it still loses to the current best configuration.","timestamp":1774500409407,"segment":0,"confidence":93.23961661341853,"asi":{"hypothesis":"Removing startup pacing entirely might let the browser queue absorb jitter better than the current 1-chunk server-side pacer.","rollback_reason":"Primary metric regressed from 784ms to 855ms and holdout penalty also worsened. The simpler 1-chunk pacer still gives a better overall tradeoff.","next_action_hint":"Keep the 1-chunk startup pacer. Remaining wins are unlikely to come from more server-side pacing tweaks.","learned_tradeoff":"Immediate-start pacing reduced total_turn_ms and chunk_count but did not improve the actual audio smoothness metric enough to beat the current best."}}
