{"type":"config","name":"Realtime TTS streaming without choppiness","metricName":"realtime_penalty_ms","metricUnit":"ms","bestDirection":"lower"}
{"run":1,"commit":"89e05d0","metric":15376,"metrics":{"first_playable_audio_ms":1478,"overlap_ms":13440,"max_chunk_deficit_ms":433,"max_binary_gap_ms":1678,"total_turn_ms":16901,"chunk_count":13,"server_first_frame_ms":500,"server_first_decode_ms":245,"server_first_queue_wait_ms":726,"holdout_realtime_penalty_ms":60195,"holdout_first_playable_audio_ms":1513,"holdout_overlap_ms":58240,"holdout_max_chunk_deficit_ms":442},"status":"keep","description":"Baseline websocket realtime benchmark on current streaming pipeline before fixes; overlap/replay dominates the user-visible penalty.","timestamp":1774493434631,"segment":0,"confidence":null,"asi":{"hypothesis":"Current choppiness is primarily caused by replayed overlapping streamed audio rather than websocket transport alone.","baseline_observation":"Median tune overlap is 13.44s and holdout overlap is 58.24s, far larger than startup latency or chunk deficit.","next_action_hint":"Write a regression test around streamed tail accounting in OnnxStreamingAudioDecoder and fix last_emitted_samples bookkeeping before tuning pacing."}}
{"run":2,"commit":"89e05d0","metric":0,"metrics":{"first_playable_audio_ms":1521,"overlap_ms":0,"max_chunk_deficit_ms":1392,"max_binary_gap_ms":1712,"total_turn_ms":0,"chunk_count":38,"server_first_frame_ms":0,"server_first_decode_ms":0,"server_first_queue_wait_ms":0,"holdout_realtime_penalty_ms":0,"holdout_first_playable_audio_ms":0,"holdout_overlap_ms":0,"holdout_max_chunk_deficit_ms":0},"status":"crash","description":"Tail-bookkeeping fix eliminated overlap on tune prompts, but the benchmark harness timed out on the holdout before completing the run.","timestamp":1774494139600,"segment":0,"confidence":null,"asi":{"hypothesis":"Advancing last_emitted_samples after each flush would remove replayed overlapping waveform windows.","observed_partial_result":"Tune prompts reached overlap_ms=0 with first_playable_audio_ms around 1.5-1.6s, but max_chunk_deficit_ms jumped to ~1.35-1.39s and chunk counts increased sharply.","rollback_reason":"Experiment crashed because BENCH_TIMEOUT_MS=90000 was too low for the longer non-overlapping runs, so the result was not fully measured.","next_action_hint":"Re-run from clean baseline with a longer per-turn benchmark timeout, then decide whether the overlap fix is a keep despite exposing severe starvation.","manual_repro":"A direct holdout-only websocket run completed in ~44.5s with 31 chunks, suggesting the timeout issue is harness-related rather than a hard product hang."}}
{"run":3,"commit":"19e3c0e","metric":2842,"metrics":{"first_playable_audio_ms":1543,"overlap_ms":0,"max_chunk_deficit_ms":1496,"max_binary_gap_ms":1816,"total_turn_ms":14495,"chunk_count":11,"server_first_frame_ms":540,"server_first_decode_ms":258,"server_first_queue_wait_ms":759,"holdout_realtime_penalty_ms":2863,"holdout_first_playable_audio_ms":1539,"holdout_overlap_ms":0,"holdout_max_chunk_deficit_ms":1324},"status":"keep","description":"Fix streamed tail bookkeeping so each decode emits only new waveform samples; this removes overlapping replay and makes starvation the next real bottleneck.","timestamp":1774494476712,"segment":0,"confidence":null,"asi":{"hypothesis":"The choppy audio was primarily caused by replayed overlapping streamed waveform windows because last_emitted_samples was never advanced after emission.","result_summary":"Primary penalty improved 81.5% (15376 -> 2842) and overlap dropped to zero on both tune and holdout prompts.","learned_bottleneck":"Once overlap is removed, chunk starvation becomes dominant: max_chunk_deficit_ms is now ~1.3-1.5s and first_playable_audio remains ~1.54s.","next_action_hint":"Target pacing and decode granularity next; chunk-count startup gating is likely too coarse now that emitted chunks are true tails."}}
{"run":4,"commit":"19e3c0e","metric":0,"metrics":{"first_playable_audio_ms":609,"overlap_ms":0,"max_chunk_deficit_ms":1071,"max_binary_gap_ms":1151,"total_turn_ms":0,"chunk_count":56,"server_first_frame_ms":0,"server_first_decode_ms":0,"server_first_queue_wait_ms":0,"holdout_realtime_penalty_ms":0,"holdout_first_playable_audio_ms":0,"holdout_overlap_ms":0,"holdout_max_chunk_deficit_ms":0},"status":"crash","description":"Set the default streaming decode batch to 1 frame to cut first-audio latency, but the benchmark timed out on the third tune prompt.","timestamp":1774494986094,"segment":0,"confidence":null,"asi":{"hypothesis":"Reducing stream decode batching from 4 frames to 1 frame would reduce first-playable latency enough to outweigh extra chunk overhead.","observed_partial_result":"Tune prompts 1 and 2 improved first_playable_audio_ms to ~0.6s and reduced max_chunk_deficit_ms to ~1.06s, but chunk_count jumped to 51 and 60 and tune:3 exceeded the 180s harness timeout.","rollback_reason":"Single-frame flushing increased websocket/message overhead and total response duration enough that the tune suite no longer completed reliably.","next_action_hint":"Try an intermediate batch size such as 2 frames, or reduce context retention, to improve slack without exploding chunk count.","partial_prompt_metrics":"tune1 first=624ms deficit=1061ms gap=1141ms chunks=51; tune2 first=594ms deficit=1071ms gap=1151ms chunks=60"}}
{"run":5,"commit":"228d95c","metric":2201,"metrics":{"first_playable_audio_ms":910,"overlap_ms":0,"max_chunk_deficit_ms":1332,"max_binary_gap_ms":1492,"total_turn_ms":43040,"chunk_count":38,"server_first_frame_ms":393,"server_first_decode_ms":130,"server_first_queue_wait_ms":384,"holdout_realtime_penalty_ms":2140,"holdout_first_playable_audio_ms":888,"holdout_overlap_ms":0,"holdout_max_chunk_deficit_ms":1252},"status":"keep","description":"Reduce the default streaming decode batch from 4 frames to 2 frames to improve startup latency and chunk deficit after fixing overlap.","timestamp":1774495398089,"segment":0,"confidence":20.553822152886116,"asi":{"hypothesis":"A 2-frame flush size would preserve the overlap fix while reducing the starvation caused by 4-frame 320ms chunks arriving too slowly.","result_summary":"Primary penalty improved from 2842 to 2201; first playable audio dropped from 1543ms to 910ms and deficit improved from 1496ms to 1332ms.","tradeoff":"Total turn time rose sharply to ~43s and chunk_count increased to 38, so future work should improve throughput without increasing per-turn duration further.","next_action_hint":"Test context reduction next, because the first chunk decode cost dropped to 130ms with batch=2 but the steady-state deficit is still >1.2s."}}
{"run":6,"commit":"dbc75dd","metric":1047,"metrics":{"first_playable_audio_ms":769,"overlap_ms":0,"max_chunk_deficit_ms":285,"max_binary_gap_ms":445,"total_turn_ms":13324,"chunk_count":50,"server_first_frame_ms":394,"server_first_decode_ms":127,"server_first_queue_wait_ms":245,"holdout_realtime_penalty_ms":1057,"holdout_first_playable_audio_ms":775,"holdout_overlap_ms":0,"holdout_max_chunk_deficit_ms":282},"status":"keep","description":"Reduce the default streaming decode context from 16 frames to 0 while keeping the 2-frame batch; this removes the main remaining decode-window cost.","timestamp":1774495635137,"segment":0,"confidence":15.965459610027855,"asi":{"hypothesis":"Retained decode context was the main remaining throughput bottleneck after moving to true tail emission and a 2-frame batch.","result_summary":"Primary penalty improved from 2201 to 1047; first playable dropped to 769ms, chunk deficit fell from 1332ms to 285ms, and total_turn_ms recovered from 43040ms to 13324ms.","learned_bottleneck":"Decode-window growth was far more expensive than chunk-count overhead; with context=0 the system is now mostly limited by startup buffering and residual per-chunk delay.","next_action_hint":"Attack the output pacer next by switching startup gating from chunk count to buffered-audio duration in milliseconds."}}
{"run":7,"commit":"41fb69a","metric":784,"metrics":{"first_playable_audio_ms":530,"overlap_ms":0,"max_chunk_deficit_ms":284,"max_binary_gap_ms":444,"total_turn_ms":22215,"chunk_count":85,"server_first_frame_ms":401,"server_first_decode_ms":126,"server_first_queue_wait_ms":1,"holdout_realtime_penalty_ms":776,"holdout_first_playable_audio_ms":516,"holdout_overlap_ms":0,"holdout_max_chunk_deficit_ms":260},"status":"keep","description":"Start audio output pacing after 1 chunk instead of 2 so playback begins as soon as the first decoded tail is ready.","timestamp":1774495880937,"segment":0,"confidence":12.64471403812825,"asi":{"hypothesis":"With overlap fixed and context removed, the remaining startup delay was mostly self-inflicted by waiting for two chunks before starting playback.","result_summary":"Primary penalty improved from 1047 to 784; first playable audio fell from 769ms to 530ms and queue wait effectively disappeared (245ms -> 1ms).","tradeoff":"Total turn time and chunk count increased, likely from workload noise and/or longer generated outputs, but holdout penalty improved too and max_chunk_deficit stayed slightly better.","next_action_hint":"Investigate async/background detokenization next, because the residual 260-284ms deficit likely comes from synchronous decode cost rather than output queueing."}}
{"run":8,"commit":"41fb69a","metric":0,"metrics":{"first_playable_audio_ms":440,"overlap_ms":0,"max_chunk_deficit_ms":30122,"max_binary_gap_ms":30202,"total_turn_ms":34073,"chunk_count":46,"server_first_frame_ms":437,"server_first_decode_ms":95,"server_first_queue_wait_ms":1,"holdout_realtime_penalty_ms":30499,"holdout_first_playable_audio_ms":462,"holdout_overlap_ms":0,"holdout_max_chunk_deficit_ms":30037},"status":"crash","description":"Prototype async/background detokenization, but the implementation stalls during final drain and creates ~30s chunk gaps.","timestamp":1774496446252,"segment":0,"confidence":12.64471403812825,"asi":{"hypothesis":"Background detokenization could hide decode cost behind frame generation and reduce the remaining ~280ms chunk deficit.","observed_partial_result":"First playable audio improved to ~440ms and server_first_decode_ms fell to ~95ms, but a ~30s gap appeared before most chunks were released.","rollback_reason":"AsyncStreamingDecoder::finish() waits for the timeout while pending_order is non-empty and does not drain ready completed chunks incrementally, so final audio is held back until the timeout path.","next_action_hint":"Add a unit test for AsyncStreamingDecoder::finish() draining ready results without waiting for timeout, then fix the loop and re-run the async experiment.","root_cause_evidence":"Tune1 streamed_audio_ms=3680 over 46 chunks, total_turn_ms=34073, and max_binary_gap_ms=29910 — consistent with one early chunk plus a 30s delayed drain."}}
{"run":9,"commit":"41fb69a","metric":668,"metrics":{"first_playable_audio_ms":394,"overlap_ms":0,"max_chunk_deficit_ms":398,"max_binary_gap_ms":558,"total_turn_ms":123530,"chunk_count":430,"server_first_frame_ms":263,"server_first_decode_ms":129,"server_first_queue_wait_ms":1,"holdout_realtime_penalty_ms":587,"holdout_first_playable_audio_ms":380,"holdout_overlap_ms":0,"holdout_max_chunk_deficit_ms":207},"status":"discard","description":"Probe lower text-before-audio interleaving (`LFM2_INTERLEAVED_N_TEXT=1`) to improve first audio, but discard because it massively increases total turn time and chunk count.","timestamp":1774496969570,"segment":0,"confidence":16.249443207126948,"asi":{"hypothesis":"Reducing text-before-audio interleaving would let the model begin speaking earlier and maybe lower the realtime penalty.","rollback_reason":"Although the primary composite improved to 668ms, total_turn_ms exploded to 123.5s and chunk_count to 430, which is a catastrophic tradeoff and likely prompt-level overfitting rather than a true realtime win.","next_action_hint":"Keep default interleaving for now and return to structural decode improvements or a better composite metric if we revisit modality scheduling.","learned_tradeoff":"Interleaving ratio strongly affects when audio begins, but the current benchmark is not allowed to trade a 3-5x longer conversation for a few hundred ms of earlier first audio."}}
{"run":10,"commit":"41fb69a","metric":2586,"metrics":{"first_playable_audio_ms":481,"overlap_ms":0,"max_chunk_deficit_ms":3545,"max_binary_gap_ms":3625,"total_turn_ms":13469,"chunk_count":122,"server_first_frame_ms":477,"server_first_decode_ms":96,"server_first_queue_wait_ms":1,"holdout_realtime_penalty_ms":5344,"holdout_first_playable_audio_ms":508,"holdout_overlap_ms":0,"holdout_max_chunk_deficit_ms":4836},"status":"discard","description":"Retry async/background detokenization with the final-drain bug fixed, but discard because ordered single-frame output still creates multi-second starvation gaps.","timestamp":1774497330814,"segment":0,"confidence":12.64471403812825,"asi":{"hypothesis":"Fixing the async final-drain bug would let background detokenization beat the current synchronous path by hiding decode cost behind generation.","rollback_reason":"Even with immediate draining, ordered single-frame async output is much worse than the current best: max_chunk_deficit_ms rose to 3545ms and holdout_realtime_penalty_ms to 5344ms.","next_action_hint":"Do not revisit single-frame async output; if async returns, keep the current 2-frame batching semantics or use a dedicated detokenizer pool behind the existing chunking model.","learned_tradeoff":"Async lowered first_playable_audio_ms to 481ms and server_first_decode_ms to 96ms, but preserving order across many tiny chunks amplified starvation and destroyed smoothness."}}
{"run":11,"commit":"41fb69a","metric":2178,"metrics":{"first_playable_audio_ms":541,"overlap_ms":0,"max_chunk_deficit_ms":3420,"max_binary_gap_ms":3580,"total_turn_ms":9040,"chunk_count":39,"server_first_frame_ms":538,"server_first_decode_ms":206,"server_first_queue_wait_ms":1,"holdout_realtime_penalty_ms":4498,"holdout_first_playable_audio_ms":507,"holdout_overlap_ms":0,"holdout_max_chunk_deficit_ms":3991},"status":"discard","description":"Probe a moderate text/audio interleaving override (`LFM2_INTERLEAVED_N_TEXT=3`), but discard because it still creates multi-second starvation gaps and hurts holdout behavior.","timestamp":1774497733837,"segment":0,"confidence":16.25849582172702,"asi":{"hypothesis":"A smaller but not extreme text-before-audio ratio might improve first audio without the pathological total-turn explosion seen at n_text=1.","rollback_reason":"This setting still caused multi-second chunk starvation (max_chunk_deficit_ms 3420, holdout 3991) and materially worsened the primary metric versus the current best 784ms baseline.","next_action_hint":"Stop probing interleaving ratios; the workload is too sensitive there. Focus remaining work on decoder-path or client-side smoothing ideas instead.","learned_tradeoff":"Interleaving overrides are not a safe realtime lever here: even moderate values can lower first-playable latency while badly harming steady-state smoothness."}}
{"run":12,"commit":"41fb69a","metric":998,"metrics":{"first_playable_audio_ms":697,"overlap_ms":0,"max_chunk_deficit_ms":361,"max_binary_gap_ms":601,"total_turn_ms":14588,"chunk_count":37,"server_first_frame_ms":503,"server_first_decode_ms":189,"server_first_queue_wait_ms":1,"holdout_realtime_penalty_ms":1303,"holdout_first_playable_audio_ms":717,"holdout_overlap_ms":0,"holdout_max_chunk_deficit_ms":586},"status":"discard","description":"Increase the default streaming decode batch from 2 frames to 3 frames, but discard because it regresses both startup and holdout smoothness.","timestamp":1774498096945,"segment":0,"confidence":12.90185676392573,"asi":{"hypothesis":"A 3-frame batch might preserve most of the 2-frame smoothness while reducing chunk count and per-chunk overhead.","rollback_reason":"Primary metric regressed from the best 784ms to 998ms, with first_playable_audio_ms rising to 697ms and holdout_max_chunk_deficit_ms more than doubling to 586ms.","next_action_hint":"Keep batch=2. If probing constants further, they should target the pacer or client path, not larger server-side decode batches.","learned_tradeoff":"Reducing chunk count from 85 to 37 did not help enough; the extra batching delay outweighed the lower message overhead."}}
{"run":13,"commit":"41fb69a","metric":860,"metrics":{"first_playable_audio_ms":565,"overlap_ms":0,"max_chunk_deficit_ms":295,"max_binary_gap_ms":455,"total_turn_ms":8938,"chunk_count":32,"server_first_frame_ms":433,"server_first_decode_ms":128,"server_first_queue_wait_ms":1,"holdout_realtime_penalty_ms":840,"holdout_first_playable_audio_ms":549,"holdout_overlap_ms":0,"holdout_max_chunk_deficit_ms":291},"status":"discard","description":"Teach the output pacer to catch up immediately when behind schedule, but discard because it slightly regresses the primary metric versus the current best.","timestamp":1774498378583,"segment":0,"confidence":18.459203036053133,"asi":{"hypothesis":"When backlog exists, preserving the old schedule instead of resetting from now would let the pacer catch up and reduce residual playout deficit.","rollback_reason":"Primary metric regressed from 784ms to 860ms. Although total_turn_ms and chunk_count improved a lot, first_playable_audio_ms and holdout penalty both got slightly worse.","next_action_hint":"Keep the simpler pacer. Residual deficit is probably dominated by chunk production timing, not pacer catch-up behavior.","learned_tradeoff":"Scheduler catch-up is real in isolation, but with the current chunk sizes and decode path it does not produce a better end-to-end websocket result."}}
{"run":14,"commit":"41fb69a","metric":871,"metrics":{"first_playable_audio_ms":587,"overlap_ms":0,"max_chunk_deficit_ms":324,"max_binary_gap_ms":484,"total_turn_ms":11702,"chunk_count":42,"server_first_frame_ms":450,"server_first_decode_ms":134,"server_first_queue_wait_ms":1,"holdout_realtime_penalty_ms":891,"holdout_first_playable_audio_ms":590,"holdout_overlap_ms":0,"holdout_max_chunk_deficit_ms":301},"status":"discard","description":"Probe a longer audio-phase run length (`LFM2_INTERLEAVED_N_AUDIO=24`), but discard because it regresses the primary metric and holdout smoothness.","timestamp":1774498573326,"segment":0,"confidence":38.50131926121372,"asi":{"hypothesis":"Longer uninterrupted audio runs might reduce modality-switch overhead and smooth the remaining ~280ms deficit.","rollback_reason":"Primary metric regressed from 784ms to 871ms, with first_playable_audio_ms and holdout penalty both worse than the current best.","next_action_hint":"Keep the default interleaving audio run length. Remaining wins are unlikely to come from modality scheduling constants.","learned_tradeoff":"Bigger audio runs reduce neither startup nor deficit enough to beat the current best sync settings."}}
{"run":15,"commit":"41fb69a","metric":1557,"metrics":{"first_playable_audio_ms":847,"overlap_ms":0,"max_chunk_deficit_ms":1309,"max_binary_gap_ms":1469,"total_turn_ms":14162,"chunk_count":24,"server_first_frame_ms":642,"server_first_decode_ms":199,"server_first_queue_wait_ms":1,"holdout_realtime_penalty_ms":1035,"holdout_first_playable_audio_ms":653,"holdout_overlap_ms":0,"holdout_max_chunk_deficit_ms":382},"status":"discard","description":"Lower ONNX intra-op threads from 8 to 4, but discard because it clearly regresses startup and chunk deficit on the current best streaming pipeline.","timestamp":1774498995876,"segment":0,"confidence":25.333333333333332,"asi":{"hypothesis":"With the current 2-frame/0-context/1-chunk pipeline, fewer ORT intra-op threads might reduce scheduling overhead and improve detokenizer responsiveness.","rollback_reason":"Primary metric regressed from 784ms to 1557ms. First playable audio rose to 847ms and max_chunk_deficit_ms jumped to 1309ms.","next_action_hint":"Keep ORT intra-op threads at 8. Thread tuning is not the remaining win on this CPU path.","learned_tradeoff":"Reducing threads did lower chunk_count, but it delayed chunk production badly enough to hurt both tune and holdout smoothness."}}
{"run":16,"commit":"41fb69a","metric":887,"metrics":{"first_playable_audio_ms":494,"overlap_ms":0,"max_chunk_deficit_ms":393,"max_binary_gap_ms":553,"total_turn_ms":25193,"chunk_count":90,"server_first_frame_ms":412,"server_first_decode_ms":78,"server_first_queue_wait_ms":1,"holdout_realtime_penalty_ms":761,"holdout_first_playable_audio_ms":472,"holdout_overlap_ms":0,"holdout_max_chunk_deficit_ms":289},"status":"discard","description":"Use a 1-frame batch only for the very first audio chunk, then switch back to the 2-frame steady-state batch, but discard because the tune-suite primary regresses.","timestamp":1774499296232,"segment":0,"confidence":38.50131926121372,"asi":{"hypothesis":"Combining the fast first chunk of batch=1 with the steadier throughput of batch=2 could improve startup without inheriting the worst single-frame overhead.","rollback_reason":"Primary metric regressed from 784ms to 887ms. First playable audio improved to 494ms, but max_chunk_deficit_ms climbed to 393ms and total_turn_ms rose to 25.2s.","next_action_hint":"Keep the simpler constant 2-frame batching. If startup is revisited, it should be through client-side buffering or a better global scheduling change, not a special-case first chunk.","learned_tradeoff":"The first chunk can be made faster, but the extra early decode cadence appears to destabilize later parts of the turn enough to lose overall."}}
